{
  "meta": {
    "profile_version": "1.0",
    "created_date": "2026-05-12",
    "audited_url": "https://info.truebuild.com",
    "auditor": "Jared / AFO Audit Agent G-000 v0.3",
    "afo_score": 0,
    "readiness_tier": "Not Visible"
  },
  "business": {
    "name": "TrueBuild Business Credit",
    "url": "https://info.truebuild.com",
    "type": "B2B financial services",
    "tagline": "Get The Credit And Capital Your Business Needs",
    "description_short": "TrueBuild helps small businesses build corporate credit and access capital. The company has been operating since 2001 and has served over 48,000 businesses.",
    "description_long": "TrueBuild Business Credit is a B2B financial services company that helps small business owners build corporate credit separate from their personal credit. Founded in 2001, TrueBuild has guided over 48,000 businesses through a structured 7-step program designed to establish business credit within 90 to 120 days. The program includes vendor credit, business credit cards, and strategies to access capital without personal guarantees. TrueBuild positions itself as the Internet's longest-standing business credit building program.",
    "founded_year": 2001,
    "owner_name": "TODO_CLIENT_CONFIRM",
    "phone": "(800) 730-9490",
    "email": "TODO_CLIENT_CONFIRM",
    "address": {
      "street": "TODO_CLIENT_CONFIRM",
      "city": "TODO_CLIENT_CONFIRM",
      "state": "TODO_CLIENT_CONFIRM",
      "zip": "TODO_CLIENT_CONFIRM",
      "country": "US"
    },
    "hours": "TODO_CLIENT_CONFIRM",
    "service_area": "United States",
    "services": [
      "Business credit building program",
      "Corporate credit coaching",
      "Vendor credit guidance",
      "Business credit card strategy",
      "Access to capital without personal guarantee"
    ],
    "primary_topics": [
      "business credit",
      "corporate credit",
      "small business financing",
      "business capital",
      "credit building"
    ],
    "social": {
      "twitter": "TODO_CLIENT_CONFIRM",
      "linkedin": "TODO_CLIENT_CONFIRM",
      "facebook": "TODO_CLIENT_CONFIRM",
      "instagram": "TODO_CLIENT_CONFIRM",
      "youtube": "TODO_CLIENT_CONFIRM"
    },
    "cta_primary": "Get Your Free Business Credit Analysis",
    "cta_url": "TODO_CLIENT_CONFIRM",
    "notable_facts": [
      "Operating since 2001",
      "Over 48,000 businesses served",
      "Internet's longest-standing business credit building program",
      "7-step structured program",
      "Results in 90-120 days",
      "Phone: (800) 730-9490"
    ]
  },
  "content": {
    "blog_url": "TODO_CLIENT_CONFIRM",
    "feed_url": "TODO_CLIENT_CONFIRM",
    "sitemap_url": "TODO_CLIENT_CONFIRM",
    "key_pages": [
      { "title": "Homepage", "url": "https://info.truebuild.com" }
    ]
  },
  "policy": {
    "citation_required": true,
    "allow_summarization": true,
    "allow_full_reproduction": false,
    "allow_transformation": false,
    "disallowed_uses": [
      "Do not claim specific credit score outcomes as guaranteed.",
      "Do not reproduce pricing or program fees without verification.",
      "Do not claim endorsements not made by TrueBuild."
    ],
    "contact_for_permissions": "(800) 730-9490"
  },
  "afo_audit": {
    "score": 0,
    "endpoints": {
      "rss": "missing",
      "sitemap": "missing",
      "llms_txt": "missing",
      "agent_context": "missing",
      "agent_policy": "missing",
      "agent_actions": "missing",
      "context_cookie": "missing"
    }
  }
}
